id	es	en
1	El pony que buscaba al [jinete] chillaba tristemente.	The pony that looked for [the horse rider] screamed sadly
2	El león que mató al [cazador] caminaba lentamente.	The lion that killed [the hunter] walked slowly
3	El caballo que miraba al [cuidador] gruñía desconsoladamente.	The horse that looked at [the keeper] growled inconsolably
4	El tigre que atacó al [domador] dormía tranquilamente.	The tiger that attacked [the tamer] slept peacefully
5	El loro que observó al [cantante] cantaba claramente.	The parrot that observed [the singer] sang clearly
6	El entrenador que escuchó al [delfín] nadaba rápidamente.	The trainer that listened to [the dolphin] swam quickly
7	El conductor que persiguió al [camello] paseaba felizmente.	The driver that chased [the camel] went for a walk happily
8	El hombre que adoraba al [canguro] saltaba incesantemente.	The man that loved [the kangaroo] jumped unceasingly
9	El amo que pegó al [orangután] gemía desconsoladamente.	The owner that hit [the orangután] moaned inconsolably
